{
  "cost_basis_id": "EQUIPMENT-COST-BASIS-SPRAY-BOOTH-V1",
  "equipment_id": "EQUIPMENT-SPRAY-BOOTH-V1",
  "status": "draft",
  "currency": "USD",
  "equipment_burden_rate_per_hour": 2.15,
  "equipment_burden_provenance": {
    "source": "engineering_estimate",
    "confidence": "draft"
  },
  "electricity": {
    "connected_load_kw": 2.2,
    "load_factor": 0.85,
    "price_per_kwh": 0.12,
    "electricity_cost_per_hour": 0.22,
    "provenance": {
      "source": "engineering_estimate",
      "confidence": "draft"
    }
  },
  "consumables_cost_per_hour": 1.85,
  "consumables_provenance": {
    "source": "engineering_estimate",
    "confidence": "draft"
  },
  "equipment_hour_rate": 4.22,
  "provenance": {
    "source": "THIN-SKIN-GUITAR-BUILD-ESTIMATE-1 sprint; all three components are engineering estimates with no owner-confirmation artifact.",
    "captured_by": "engineering",
    "capture_date": "2026-07-26",
    "confidence": "draft",
    "references": [
      "EQUIPMENT-SPRAY-BOOTH-V1 (equipment profile)",
      "fixtures/machines/cost_basis/bcm_2030ca_atc_cost_basis_v1.json (rate-assembly pattern)"
    ]
  },
  "notes": [
    "Burden ($2.15/hr) is an engineering estimate: ~$6,000 booth capital (enclosure, exhaust, make-up air, lighting) over a 7-year life at an assumed 400 occupancy-hours/year = 2,800 hours, giving $2.14/hr, rounded to $2.15. Not owner-confirmed.",
    "Electricity ($0.22/hr) = 2.2 kW x load_factor 0.85 x $0.12/kWh. Load factor 0.85 assumes the exhaust fan runs essentially continuously whenever the booth is occupied.",
    "Consumables ($1.85/hr) covers intake and exhaust filters plus booth wall coating. Masking, tack cloth, and solvent are estimate material inputs, not booth consumables, so they are not counted twice.",
    "equipment_hour_rate ($4.22/hr) is a true-cost rate: burden 2.15 + electricity 0.22 + consumables 1.85. COST input, not a billing rate.",
    "Excludes any regulatory, permitting, or VOC-compliance cost. Those are overhead and belong to GUITAR-FULL-UNIT-COST-1, not to this direct-cost layer.",
    "Record status is 'draft' because every component is an unconfirmed engineering estimate.",
    "connected_load_kw (2.2) mirrors EQUIPMENT-SPRAY-BOOTH-V1 connected_load_estimate.total_kw."
  ]
}
